2026-07-09T15:46:21,hii the product is vey good,happy,1.0,greeting,Good to hear! Let know if there's anything else.
2026-07-09T15:58:51,gu,calm,0.0,other,Thanks for the message - can you give me a bit more detail?
2026-07-09T16:03:13,are you mad,upset,-1.0,other,Sounds like this hasn't gone well. Tell me more and I'll try to fix it.
2026-07-09T16:07:09,hii,calm,0.0,greeting,Hey! What can I help you with?
2026-07-09T16:07:41,nkknnm,calm,0.0,other,Thanks for the message - can you give me a bit more detail?
2026-07-13T23:47:35,bcnc,calm,0.0,other,Thanks for the message - can you give me a bit more detail?
